{
  "schema_version": 1,
  "max_stalled_runs": 3,
  "notification": {
    "mode": "alert_file",
    "fallback": "alert_file"
  },
  "defaults": {
    "model": "gpt-5.5",
    "reasoning_effort": "xhigh"
  },
  "phases": {
    "0": {
      "model": "gpt-5.5",
      "reasoning_effort": "xhigh"
    },
    "1": {
      "model": "gpt-5.5",
      "reasoning_effort": "xhigh"
    },
    "2": {
      "model": "gpt-5.5",
      "reasoning_effort": "xhigh"
    },
    "finalization": {
      "model": "gpt-5.5",
      "reasoning_effort": "xhigh"
    }
  }
}
